name,address,phone_number,website,description
Eglinton West Dental,"1114 Eglinton Ave W, Toronto, ON M6C 2E2",647-484-2557,http://eglintonwestdental.ca/,"We offer preventitive, restorative and cosmetic dental services."
Dentistry on Danforth,"249 Danforth Ave, Toronto, ON M4K 1N2",647-360-3815,http://www.dentistryondanforth.com/,"Dentistry on Danforth Provides Comprehensive Dentistry In One Location-Preventive & General Dentistry, Cosmetic, Implant and Restorative Dentistry"
Vernon Koo,"1920 Yonge St, Toronto, ON M4S 3E2",647-498-0073,http://www.yongedavisvilledentistry.com/,"Comprehensive General Practice-New Patients & Emergencies Welcome-Cosmetic Dentistry, Family Dentistry."
Danforth Dentistry - Dr. Strugurescu,"309-745 Danforth Ave, Toronto, ON M4J 1L4",647-723-9559,http://www.danforthdentistry.com/,Dr. Michael Strugurescu focuses on aiding and maintaining complete oral health.
Dr Steven & Dr Jonathan Stern Dentistry,"2-49 Eglinton Ave E, Toronto, ON M4P 1G6",647-846-7243,http://drstern.ca/,Don?t let your anxiety about going to the dentist keep you from getting the care you need!
Endodontic Specialists - Bay Street,"1235 Bay St., Toronto, ON M5R 3K4",416-963-9988,http://www.rootcanals.ca/,Endodontic Specialists - Bay Street is your Family-friendly Endodontist in Toronto and we welcome you and your family to visit us.
Dr Paul S Monczka,"103-795 Eglinton Ave E, East York, ON M4G 4E4",416-424-3477,https://www.yellowpages.ca/search/si/1/Dentists/<javascript:void\(0\)>,Dentists
Dr Violeta Danciu,"2329 Dundas St W, Toronto, ON M6R 1X6",416-533-4973,http://www.danciudentist.com/,Dr. Violeta Danciu is an experienced Toronto family dentist who provides truly exceptional dental care and satisfaction to for her patients over many years.
Royal Bank Plaza Dental Centre,"200 Bay St, Toronto, ON M5J 2J3",437-889-3282,http://www.royaldentalcentre.com/,Oral Hygiene/Preventive Care Teeth Whitening Implants Crown/bridges/veneers Dentures/Extractions Sports Mouth Guards/TMJ night guards Complimentary Cosmetic Consultation Orthodontics & Invisalign
Dagys Arlene P Dr,"340 Kingston Road, Toronto, ON M4L 1T7",416-690-8525,https://www.facebook.com/1701420380146028,Dagys Arlene P Dr is a Toronto-based dentist.
Dr Robert Elia,"175 York Mills Rd, North York, ON M2L 1K6",416-512-6431,http://www.facebook.com/760044720798682,Dr Elia is proud North York Dentist
Yonge Eglinton Periodontics & Implant Surgery,"2300 Yonge Street, Toronto, ON M4P 1E4",416-481-1179,http://www.drandrewkay.com/,"Located in Toronto, Yonge Eglinton Periodontics & Implant Surgery offers a range of care options for better oral health."
Dr Marta Prystayko,"305-2425 Bloor St W, Toronto, ON M6S 4W4",647-484-2943,http://www.facebook.com/1186411154705330,Practicing family dentistry in the Bloor West community for over 30 years.
Oral Surgery Practice,"340 College St, Toronto, ON M5T 3A9",416-924-9673,https://www.yellowpages.ca/search/si/1/Dentists/<javascript:void\(0\);>,"For reliable dental care in the downtown Toronto area, visit Oral Surgery Practice on College Street today."
Dr Mark Nusinoff,"203-2179 Yonge St, Toronto, ON M4S 2B1",416-488-6633,https://yongestreetdental.com/,Yonge Street Dental
Forest Hill Village Orthodontics,"740 Eglinton Ave W, Toronto, ON M5N 1C4",416-789-1231,http://www.foresthillvillageorthodontics.com/,"Located in Toronto and Aurora, Ontario, our practice's top priority is to provide you the highest quality orthodontic care in a friendly, comfortable environment"
Scarlett Road Dentistry,"263 Scarlett Rd, York, ON M6N 4L1",416-763-3773,http://www.scarlettroaddentistry.com/,Dr Lorne Levy
Concorde Gate Dental,"1 Concorde Gate, North York, ON M3C 3N6",647-360-3931,http://smilexperts.ca/,"Concorde Gate Dental's purpose of their online location is to introduce you to them and tell you about their practice, their philosophy and their staff."
Ing Katherine Dr,"586 Eglinton Ave E, Toronto, ON M4P 1P2",416-486-6765,http://leasidesmiles.com/,Our friendly home-like environment promotes a positive introduction to visiting the dentist.
Costache Dentistry Professional Corporat,"1066 Bloor St W, Toronto, ON M6H 1M6",416-534-9991,http://costachedentistry.com/,"Costache Dentistry Professional Corporat offers Galleria Shopping Centre, Wisdom Teeth, Root Canal, Cosmetic Dentistry, Teeth Cleaning, Mouth Guard, Teeth Whitening, Tooth Bonding, Dental Examination, Tooth Extraction, Veneer."
Coxwell Dental Health Centre,"721 Coxwell Ave, Toronto, ON M4C 3C3",416-463-2523,https://coxwelldental.com/,"At the Coxwell Dental Health Centre, we put smiles first and can help you feel better by assisting you in maintaining good oral health."
Dr Sharon Perlmutter,"500 Glencairn Ave, North York, ON M6B 1Z1",416-783-2272,,Perlmutter Dentistry.
Orthodontics on Danforth,"758 Danforth Ave, Toronto, ON M4J 1L5",416-465-8880,http://www.orthodonticsondanforth.com/,"At Orthodontics on Danforth, we provide comprehensive orthodontic care in a friendly and family-oriented environment."
George Zarb Dentistry Professional Corporation,"2300 Yonge St, Toronto, ON M4P 1E4",416-488-1643,http://gzarbdentistry.com/,Dr. George Zarb and his team provide customized treatments designed to keep you smiling and their clinic serves the dental needs of Toronto residents.
Sturm Judy Dr,"77 Bloor St W, Toronto, ON M5S 1M2",416-967-4212,http://www.yorkvillesmiles.com/,"Keeping your smile happy and healthy is the number one priority of Dr. Judy Sturm & Associates, providing quality general and cosmetic dentistry services."
Yorkville Oral & Maxillofacial Surgery,"130 Bloor Street West, Toronto, ON M5S 1N5",416-923-2100,https://www.yorkvilleoralsurgery.com/,Yorkville Oral & Maxillofacial Surgery practices a full scope of oral and maxillofacial surgery with expertise ranging from corrective jaw surgery to wisdom tooth removal.
Dr Miriam Grushka,"2-974 Eglinton Ave W, Toronto, ON M6C 2C5",416-787-2930,http://miriamgrushka.ca/,Dr. Grushka graduated from Dentistry at the University of Toronto and completed her Ph.D. studies in Dentistry at the same university in 1986.
Borovac Dentistry,"60 Bloor St W, Toronto, ON M4W 3B8",416-922-1012,http://www.nicholaskempdentistry.com/,"We offer a comprehensive range of Hygiene Services including irrigation, polishing, desensitization and teeth whitening."
Dr Daniel Zimmerman,"883 Jane St, York, ON M6N 4C4",416-767-6591,,Looking for a dentist ASAP? Dr Daniel Zimmerman is your oral health expert in York.
Staibano Philip Dr,"2221 Keele St, North York, ON M6M 3Z5",416-247-9257,http://www.facebook.com/1150940648273911,Dentists.
Doctor Mincer Samuel,"1916 Avenue Road, North York, ON M5M 4A1",416-256-0907,http://www.facebook.com/392864124487459,Avenue Dental.
Dr Bruce Stanley,"203-2179 Yonge St, Toronto, ON M4S 2B1",416-488-6633,,Yonge Street Dental.
Goodman Howard E Dr,"1 Concorde Gate, North York, ON M3C 3N6",416-441-3232,http://www.smilexperts.ca/,"Dr. Howard Goodman graduated from McGill University Dental School, in 1972 and has been practicing dentistry together in Toronto for over 30 years."
Cadas Chris P Dr,"33 Harbour Square, Toronto, ON M5J 2G2",416-862-0140,https://www.facebook.com/328825317598015,Contact us today.
High Park Dental Care,"2184A Bloor St W, Toronto, ON M6S 1N3",416-766-6383,http://www.highparkdentalcare.com/,High Park Dental Care offers dental clinics & centres and dentists services.
Dr Ester Canton Dentistry,"128-55 St Clair Ave W, Toronto, ON M4V 2Y7",647-352-2010,,Dr Ester Canton Dentistry provides dental and prosthodontists services.
Cudmore C J Dr,"1849 Yonge St, Toronto, ON M4S 1Y2",416-486-0964,,Cudmore C J Dr is a dentist.
Eng Robert Dr & Friedlich Joseph Dr,"216-1560 Yonge St, Toronto, ON M4T 2S9",416-921-7477,http://www.yongestclairoralsurgery.com/,"Eng Robert Dr & Friedlich Joseph Dr is an Oral and Maxillofacial Surgery practice dedicated to managing a wide scope of injuries or diseases pertaining to the head, neck, face, jaw, mouth and teeth in the oral an..."
Dr. M. L. Bygrave,"2380 Eglinton W, York, ON M6M 1S6",416-651-5466,http://drmlbygrave.com/,"Bring the whole family to the clinic of Dr. M. L. Bygrave in York, Ontario, for your oral health needs."
Dr. John R Gay,"340 College St, Toronto, ON M5T 3A9",416-924-9673,,Dr. John R Gay is an Oral Surgery Practice.
The College & Dufferin Dental Clinic,"1111a College Street, Toronto, ON M6H 1B4",647-558-3148,https://collegestreetdentist.com/,"Our mouth is the most important part of our body, and it serves as a source of immense pleasure in various aspects of life, such as eating, drinking, breathing, speaking, and relis..."
Dr George Elias,"4-1730 Bloor St W, Toronto, ON M6P 1B3",416-766-2222,,Dr George Elias is a dentist.
Fort York Dentist,"219 Fort York Boulevard, Toronto, ON M5V 1B1",647-346-8888,https://www.fortyorkdentist.com/,Our Dental Clinic is located in downtown Toronto and provides the highest standard of dental care.
Cabbagetown Dental Centre,"588 Parliament St, Toronto, ON M4X 1P8",416-927-7600,https://cabbagetowndental.com/,"Whether you’re looking for cosmetic dentistry, teeth whitening, implants, or braces, Cabbagetown Dental Centre in Toronto believes in providing you with gentle, caring service."
Crossways Family Dental,"2340 Dundas St W, Toronto, ON M6P 4A9",416-535-5799,,Dr Jarvis and Dr Krystyna Jarvis welcome you to Crossways Family Dental.
Mazzatto Anthony Dr,"65 Queen Street West, Toronto, ON M5H 2M5",416-368-9949,,Dr. Anthony Mazzatto welcomes new patients to his dental office located in downtown Toronto.
Dr M J Appleby,"Bloor Street West, Toronto, ON M6G 1M4",416-531-5111,https://www.facebook.com/pages/Dr-Appleby/324421624278155,Dr M J Appleby is a dentist.
Yonge & St.Clair Oral Surgery Assoc.,"1560 Yonge Street, Toronto, ON M4T 2S9",416-921-7477,http://www.yongestclairoralsurgery.com/,"We are an oral and maxillofacial Surgery practice dedicated to managing a wide scope of injuries or diseases pertaining to the head, neck, face, jaw, mouth and teeth in the oral an..."
Harbour Dental Centre,"8-12 Yonge Street, Toronto, ON M5E 1Z9",416-214-9119,https://dentalcentres.com/,A mix of urban elegance and charm make our location at the base of \' vibrant Yonge Street among the top medical facilities in Toronto.
Dental Arts At Front-Invisalign Toronto,"350 Front St W, Toronto, ON M5V 3W7",437-747-7613,https://invisalign-toronto.ca/,Dental Arts At Front-Invisalign Toronto offers dental and orthodontist services.
Dental Arts At Lawrence-Invisalign Toronto,"485 Lawrence Ave W, North York, ON M5M 1C6",437-747-3913,https://www.yellowpages.ca/search/si/2/Dentists/</bus/Ontario/North-York/Dental-Arts-At-Lawrence-Invisalign-Toronto/102453155.html?what=Dentists&where=Toronto+ON&useContext=true,Dental Arts At Lawrence-Invisalign Toronto is a dental practice located in North York.
Emergency-Dental-365.com,"2b-300 York Mills Rd, North York, ON M2L 2Y5",647-693-8312,http://www.emergency-dental-365.com/,"Emergency-Dental-365.com provides emergency dental care, including treatment for toothaches, orthodontic emergencies, trauma from accidents, and broken tooth fillings."
Dentistry on Dufferin,"2992 Dufferin St, North York, ON M6B 3T3",647-849-3146,http://dentistryondufferin.ca/,"Dentistry On Dufferin provides complete family dental care in a relaxed, modern facility with digital equipment."
Apple Tree Dental for Kids,"895 Lawrence Ave E, North York, ON M3C 3L2",647-495-7863,http://www.appletreedentalforkids.com/,Appletree Dental for Kids is a pediatric dental office aimed at serving children ages 1 to 17.
Solomon Jeff Dr,"1114 Eglinton Ave W, Toronto, ON M6C 2E2",416-782-1711,http://eglintonwestdental.ca/,"Dr. Jeff Solomon at Eglinton West Dental specializes in preventive and restorative dentistry, providing general and cosmetic dental needs."
Dr Andrew Kay,"706-2300 Yonge St, Toronto, ON M4P 1E4",416-481-1179,http://drandrewkay.com/,Dr. Andrew Kay practices at Yonge Eglinton Periodontics & Implant Surgery.
Dr. Neil Hahn,"2184A Bloor W, Toronto, ON M6S 1M8",416-766-6383,http://highparkdentalcare.com/,Dr. Neil Hahn practices at High Park Dental Care.
Infusini Frank Dr,"3200 Dufferin St, North York, ON M6A 3B2",416-781-8777,http://www.facebook.com/1607524952855837,Infusini Frank Dr is a dentist located in North York.
Salama Sam Dr,"2425 Bloor St W, Toronto, ON M6S 4W4",416-604-2262,https://www.yellowpages.ca/search/si/2/Dentists/</bus/Ontario/Toronto/Salama-Sam-Dr/1385250.html?what=Dentists&where=Toronto+ON&useContext=true,Salama Sam Dr is a dentist and oral and maxillofacial surgeon in Toronto.
Leaside Dental Care,"795 EglintonE, East York, ON M4G 4E4",416-424-3477,http://www.facebook.com/823534437751673,Leaside Dental Care is a dental practice located in East York.
Frackowiak Anne Marie Dr,"2351 Queen St E, Toronto, ON M4E 1H2",416-691-4768,http://drannemarie.com/,Dr. Anne Marie Frackowiak is a certified orthodontist with multiple locations in the York Durham region.
Dr Samantha Fialkov,"500 Glencairn Ave, North York, ON M6B 1Z1",416-783-2272,https://www.yellowpages.ca/search/si/2/Dentists/</bus/Ontario/North-York/Dr-Samantha-Fialkov/102224569.html?what=Dentists&where=Toronto+ON&useContext=true,Dr. Samantha Fialkov practices at Perlmutter Dentistry.
Dr Allan Goodman,"101-1 Concorde Gate, North York, ON M3C 3N6",416-441-3232,http://www.smilexperts.ca/,"Dr. Allan Goodman at Concorde Gate Dental has an exceptional, helpful, knowledgeable and friendly staff."
Your Smile Dental Care,"65 Viewmount Ave, North York, ON M6B 1T2",416-783-3533,http://www.yoursmiledentalcare.com/,Your Smile Dental Care is a dental practice located in North York.
Dr Budning & Warchuk,"305-65 Wellesley St E, Toronto, ON M4Y 1G7",416-923-3325,https://www.yellowpages.ca/search/si/2/Dentists/</bus/Ontario/Toronto/Dr-Budning-Warchuk/101529119.html?what=Dentists&where=Toronto+ON&useContext=true,Dr Budning & Warchuk is a dental practice located in Toronto.
Parkway Mall,"85 Ellesmere Rd, Scarborough, ON M1R 4B9",416-445-0235,https://parkwaymall.ca/,Parkway Mall is a shopping center that includes administration offices and dental clinics.
Royal Bank,"330 Front St W, Toronto, ON M5V 3B7",416-974-4115,https://www.facebook.com/pages/Royal-Bank-Of-Canada/135745617113457,Royal Bank is a bank located in Toronto.
"Dr. Duc Nguyen, DDS","221-10720 Yonge St, Richmond Hill, ON L4C 3C9",905-737-7788,N/A,Dr. Duc Nguyen offers top-quality family and cosmetic dentistry in Richmond Hill.
Dr Law Winston,"295A Queen St E, Brampton, ON L6W 3W9",905-450-5800,http://drwinstonlaw.com/,Bramrose Dental Office
Keele & Finch Dental Office,"1280 Finch Avenue West, North York, ON M3J 3K6",416-667-7672,https://keeleandfinchdentaloffice.com/,At Keele and Finch Dental Office our goal is to provide you and your family the best quality of care.
"Dr. S Fenwick, Dr. R Klein & Associates","619 Kingston Rd W, Ajax, ON L1S 6L8",289-275-2036,N/A,"Have a toothache? Call Dr. S Fenwick, Dr. R Klein & Associates in Ajax."
Dr Yaw Okraku,"98 Glen Shields Ave, Concord, ON L4K 1T6",905-669-5837,N/A,Dentists
Humber River Dentistry,"1340 Wilson Ave, North York, ON M3M 1H8",416-244-5659,http://drhbelman.ca/,Dentists
Dr Shafarenko Dental,"895 Wilson Ave, North York, ON M3K 1E6",416-630-5164,http://www.facebook.com/404955053304286,Dentists
Mummery Janice Dr,"3052 Bloor St W, Etobicoke, ON M8X 1C4",416-231-4562,https://princeviewdental.com/,Princeview Dental Group
Farn Ronald Dr,"111 Ellesmere Rd, Scarborough, ON M1R 4C3",416-449-2838,http://www.facebook.com/173750759880280,Dentists
Laborers' Union Local 183 Dental Clinic,"1263 Wilson Ave, North York, ON M3M 3G2",416-241-1190,http://www.liunalocal183.ca/,Dentists
Dr Tom Veiledal,"305-1 Palace Pier Crt, Etobicoke, ON M8V 3W9",416-251-4370,N/A,Dentists
Dr M Shorser,"2083 Lake Shore Blvd W, Etobicoke, ON M8V 4G2",647-846-7274,N/A,Dentists
Lakeshore Dental. Cosmetic and Implant Dentistry. Dr Izabela Olczyk & Associates,"16 Brookers Lane, Toronto, ON M8V 0A5",416-255-6400,http://www.lakeshoredental.ca/,Dentists
Reyes S Dr,"4-1089 Kingston Rd, Scarborough, ON M1N 4E4",416-691-4146,N/A,Dentists
Beach Braces,"1089 Kingston Rd, Scarborough, ON M1N 4E4",416-690-4540,http://www.beachbraces.ca/,Dr John Daskalogiannakis
Sunrise Kids Dental,"1089 Kingston Rd, Scarborough, ON M1N 4E4",647-350-7562,http://www.facebook.com/1534718876740897,Dental Clinics & Centres
Upper Beaches Dental,"4-1120 Kingston Rd, Scarborough, ON M1N 1N4",416-682-7017,N/A,Dental Clinics & Centres
Park Lawn Smiles Dental,"6-2183 Lake Shore Blvd W, (Unit Ls), Etobicoke, ON M8V 0J2",647-483-0545,N/A,Dental Clinics & Centres
Altima Coxwell Dental Centre,"704 Coxwell Ave, Toronto, ON M4C 3B9",416-465-9343,https://www.altimadental.com/locations/coxwell,"A dental center located at 704 Coxwell Ave, Toronto."
Altima Dental Centre at First Canadian Place,"100 King St, Unit C13, Toronto, ON M5X 2A1",416-368-7226,https://www.altimadental.com/locations/first-canadian-place,A dental clinic located at First Canadian Place in Toronto.
Riverside Dental,"690 Queen St E, Toronto, ON M4M 1G9",647-348-6900,https://riversidedentalcenter.ca/,A dental clinic located on Queen St E in Toronto.
Country Dental,"396 Broadway Ave, Toronto, ON M4G 0C3",416-335-7377,http://www.facebook.com/185557445148280,A dental clinic located on Broadway Ave in Toronto.
Altima Scotia Plaza Dental Centre,"104 Yonge St, Unit 214, Toronto, ON M5C 2Y6",416-644-1122,https://www.altimadental.com/locations/scotia-plaza,"A dental center located in Scotia Plaza, Toronto."
Altima Annex Dental Centre,"201-535 Bloor St W, Toronto, ON M5S 1Y5",416-535-1167,https://www.altimadental.com/locations/annex,A dental center located on Bloor St W in Toronto.
Altima College West Dental Centre,"979 College St, Toronto, ON M6H 1A6",416-533-5544,https://www.altimadental.com/locations/college-west,A dental center located on College St in Toronto.
Altima Yonge-Eglinton Dental Centre,"2300 Yonge St, #Fl 2, Toronto, ON M4P 1E4",416-322-9944,https://www.altimadental.com/locations/yonge-eglinton,A dental center located on Yonge St in Toronto.
Soho Dental,"147 Spadina Ave, Toronto, ON M5V 2L7",416-340-7646,https://sohodental.ca/,A dental clinic located on Spadina Ave in Toronto.
City Dental,"415 Yonge St, Toronto, ON M5B 2E7",416-845-5500,https://citydentaltoronto.com/,A dental clinic located on Yonge St in Toronto.
Princeview Dental Group,"3052 Bloor St W, Etobicoke, ON M8X 1C4",416-231-4562,https://princeviewdental.com/,A dental group located on Bloor St W in Etobicoke.
Park Home Dental,"5 Park Home Ave, North York, ON M2N 6L4",416-221-6333,http://parkhomedental.com/,Park Home Dental provides a full range of general and cosmetic dental services.
Chiu Helen Dr,"358-5 Fairview Mall Dr, North York, ON M2J 2Z1",647-494-3661,http://drhelenchiupaediatricdentistry.ca/,Dr. Helen Chiu Pediatric Dentist is a child friendly dental office located in Willow.
Dr. David Eisenstat,"4190 Finch Avenue East, Scarborough, ON M1S 4T7",647-361-2653,http://dentistryforchildrentoronto.ca/,Dr. David Eisenstat's dental office in Scarborough caters to children.
Braceland Orthodontists,"3420 Finch Ave E, Scarborough, ON M1W 2R6",647-849-3460,https://www.mybraceland.com/,Braceland Orthodontists in Toronto focuses on making your teeth look their best.
Cosentino Maria Dr,"3327 Bloor Street West, Etobicoke, ON M8X 1E7",647-361-4959,http://www.drmariacosentino.com/,Dr. Maria Cosentino Dentistry provides patients with the highest level of dental care in a comfortable and professional atmosphere.
